{
  "schema_version": "visual-review-1.0",
  "review_id": "VR-SIDE-CABIN-001",
  "run_id": "RUN-VISUAL-SYNTHETIC-001",
  "region_id": "SIDE-CABIN",
  "iteration": 1,
  "reference_package_sha256": "5555555555555555555555555555555555555555555555555555555555555555",
  "cad_render_sha256": "4444444444444444444444444444444444444444444444444444444444444444",
  "mutation_sha256": "3333333333333333333333333333333333333333333333333333333333333333",
  "geometry_comparison_sha256": "6666666666666666666666666666666666666666666666666666666666666666",
  "verdict": "FAIL",
  "severity": "MAJOR",
  "confidence": 0.94,
  "findings": [
    {
      "finding_id": "FIND-001",
      "category": "SHAPE_MISMATCH",
      "feature": "CABIN_ROOF",
      "severity": "MAJOR",
      "description": "Roof contour is too high relative to the approved source.",
      "evidence_refs": ["overlay.png", "difference-mask.png"]
    }
  ],
  "repair_intent": {
    "change": ["LOWER_CABIN_ROOF_MIDPOINT"],
    "preserve": ["FRONT_AXLE_CENTER", "CABIN_BOTTOM_DATUM"],
    "required_measurements": ["CABIN_MAX_HEIGHT"],
    "requested_next_evidence": []
  }
}
